{
  "kind": "paper-theater-cue-sheet",
  "schema_version": "1.0",
  "duration_ms": 1000,
  "packages": {
    "boke": "variant-export-package-aaaaaaaaaaaaaaaaaaaa/package-manifest.json",
    "tsukkomi": "variant-export-package-bbbbbbbbbbbbbbbbbbbb/package-manifest.json"
  },
  "stage_slots": {
    "boke": "left",
    "tsukkomi": "right"
  },
  "initial": {
    "boke": "boke.neutral",
    "tsukkomi": "tsukkomi.neutral"
  },
  "events": [
    {
      "at_ms": 500,
      "role": "boke",
      "key": "boke.smile"
    },
    {
      "at_ms": 500,
      "role": "tsukkomi",
      "key": "tsukkomi.retort"
    }
  ]
}
